{
  "audit_root_identity": "CALLER_SUPPLIED_LOCAL_ROOT_NOT_EMBEDDED",
  "files": [
    {
      "actual_sha256": "6da4a688aafc148ccc4f36e92263042db6ef6c9ba3d73536152345c587f5c210",
      "category": "build",
      "expected_sha256": "6da4a688aafc148ccc4f36e92263042db6ef6c9ba3d73536152345c587f5c210",
      "hash_match": true,
      "path": "harness.c",
      "role": "candidate_harness",
      "size_bytes": 402
    },
    {
      "actual_sha256": "6da4a688aafc148ccc4f36e92263042db6ef6c9ba3d73536152345c587f5c210",
      "category": "harness",
      "expected_sha256": "6da4a688aafc148ccc4f36e92263042db6ef6c9ba3d73536152345c587f5c210",
      "hash_match": true,
      "path": "harness.c",
      "role": "candidate_harness",
      "size_bytes": 402
    },
    {
      "actual_sha256": "b3c0cf01f55f7c98cf820b67ccaceb62e1f22ed9e91a4f717d642cda3223eb5b",
      "category": "build",
      "expected_sha256": "b3c0cf01f55f7c98cf820b67ccaceb62e1f22ed9e91a4f717d642cda3223eb5b",
      "hash_match": true,
      "path": "include/vector.h",
      "role": "production_header",
      "size_bytes": 119
    },
    {
      "actual_sha256": "b3c0cf01f55f7c98cf820b67ccaceb62e1f22ed9e91a4f717d642cda3223eb5b",
      "category": "production",
      "expected_sha256": "b3c0cf01f55f7c98cf820b67ccaceb62e1f22ed9e91a4f717d642cda3223eb5b",
      "hash_match": true,
      "path": "include/vector.h",
      "role": "production_header",
      "size_bytes": 119
    },
    {
      "actual_sha256": "c9cfd7cfb0c5d07b07d7853efdcd1b6b9b923c2425d7f2b018dd3f79e289ab59",
      "category": "build",
      "expected_sha256": "c9cfd7cfb0c5d07b07d7853efdcd1b6b9b923c2425d7f2b018dd3f79e289ab59",
      "hash_match": true,
      "path": "src/vector.c",
      "role": "production_source",
      "size_bytes": 179
    },
    {
      "actual_sha256": "c9cfd7cfb0c5d07b07d7853efdcd1b6b9b923c2425d7f2b018dd3f79e289ab59",
      "category": "production",
      "expected_sha256": "c9cfd7cfb0c5d07b07d7853efdcd1b6b9b923c2425d7f2b018dd3f79e289ab59",
      "hash_match": true,
      "path": "src/vector.c",
      "role": "authoritative_target_definition",
      "size_bytes": 179
    }
  ],
  "request_id": "vector-subtract-integrity-001",
  "schema_version": "1.0",
  "undefined_functions_diagnostic": {
    "actual_sha256": "1405e3bb94f4171beda0e95c0a4b92f381b8349f1e82f5f40b9d52def8cae9ec",
    "expected_sha256": "1405e3bb94f4171beda0e95c0a4b92f381b8349f1e82f5f40b9d52def8cae9ec",
    "format": "goto-instrument-list-undefined-functions-text",
    "hash_match": true,
    "path": "diagnostics/undefined_functions.txt",
    "size_bytes": 45
  }
}
